{"artifactBytes":46707,"artifactDigest":"sha256:1bb9aed7553750f0161dadaba531583101d34eef2b35110e326d4d4a20153826","artifactKind":"PORTABLE_CONTRACT","artifactPath":"portable-contract.v1.jcs.json","format":"ceragon.ai-security.portable-release","formatVersion":1,"generatorName":"ceragon-ai-security-artifact","generatorVersion":"1.1.0","requiredIntegrationGate":"P0-C07","runtimeActivatable":false,"signedRuntimePolicyBundle":false,"sourcePackageName":"@ceragon/shared-contracts","sourcePackageVersion":"0.3.0","v2WriterEligible":false}